"type"; "name"; "description"; "time"; "price"; "location"; "area"; "note"
"see"; "Vong Canh Hill"; "viewpoint"; "morning"; "free"; "Huyen Tran Cong Chua Street"; "south"; "A scenic hill with a panoramic view of the Perfume River and royal tombs. Great for sunrise or quiet afternoon picnics."
"see"; "Hai Van Pass"; "mountain road"; "all-day"; "free"; "on National Route 1A"; "north"; "A famous coastal road with hairpin turns and ocean views. Popular with motorbike travelers."
"see"; "Hon Chen Temple"; "temple"; "morning"; "free"; "Ngoc Ho Village"; "west"; "Colorful temple on a hill overlooking the river. Worships a goddess, blend of Buddhism and folk beliefs."
"see"; "Redemptorist Church"; "church"; "morning"; "free"; "Nguyen Hue Street"; "center"; "Large Catholic church with tall spires and peaceful garden. Open to visitors outside mass hours."
"see"; "Bach Ma National Park"; "nature reserve"; "all-day"; "150k VND (~6$)"; "Phong Dien District"; "west"; "Mountain park with hiking trails, waterfalls, and wildlife. Best for nature lovers and trekkers."
"see"; "Phu Cam Cathedral"; "church"; "morning"; "free"; "Phan Dinh Phung Street"; "center"; "Modernist-style Catholic cathedral. Known for its stained glass and elevated location."
"see"; "Hue War Museum"; "museum"; "afternoon"; "40k VND (~1.6$)"; "23 Doi Cung Street"; "center"; "Displays photos and artifacts from the Vietnam War, especially in the central region."
"see"; "Thua Thien Hue Library"; "library"; "afternoon"; "free"; "12A Le Loi Street"; "center"; "Historic French-style library open to the public. Quiet space for reading or studying."
"see"; "Lang Co Bay"; "beach"; "all-day"; "free"; "Lang Co Town"; "north"; "Stretch of white sand along the coast with fishing boats and fresh seafood restaurants."
"see"; "Nguyen Dinh Chieu Walking Street"; "night market"; "evening"; "free"; "Nguyen Dinh Chieu Street"; "center"; "Pedestrian street with local vendors, food stalls, and river views. Lively every weekend."
"see"; "Huong River Park"; "park"; "afternoon"; "free"; "Le Loi Street riverside"; "center"; "Green park with river views, benches, and public sculptures. Great for evening strolls."
"see"; "Lap An Lagoon"; "nature"; "all-day"; "free"; "Lang Co Area"; "north"; "A mirror-like lagoon surrounded by mountains. Famous for oyster farms and seafood shacks."
"see"; "Gia Long Tomb"; "tomb"; "all-day"; "150k VND (~6$)"; "Huong Tho Commune"; "west"; "Tomb of the first Nguyen emperor. Remote and forested with old structures and lakes."
"see"; "Truc Lam Bach Ma Zen Monastery"; "monastery"; "morning"; "free"; "Bach Ma National Park"; "west"; "Peaceful monastery located near a lake. Best for spiritual retreats or quiet reflection."
"see"; "Hue Citadel Wall Walk"; "heritage walk"; "morning"; "free"; "outer Citadel walls"; "citadel"; "You can walk a segment of the ancient wall for views of the city and moat."
"see"; "Japanese Covered Bridge (Hue)"; "bridge"; "morning"; "free"; "Bao Vinh Old Town"; "northeast"; "Small covered wooden bridge in ancient town area. Echoes similar designs to Hoi An."
"see"; "Bao Vinh Ancient Town"; "old quarter"; "morning"; "free"; "Bao Vinh Ward"; "northeast"; "Faded French and Chinese shophouses. Quiet and nostalgic, good for urban exploration."
"see"; "An Hien Garden House"; "traditional home"; "morning"; "50k VND (~2$)"; "58 Nguyen Phuc Nguyen"; "citadel"; "Old aristocratic house with garden courtyard and wooden beams. Represents Hue's elite past."
"see"; "Co Ha Garden"; "royal garden"; "morning"; "free"; "inside Imperial City"; "citadel"; "Well-restored garden with bonsai trees and pavilions. Quiet corner inside the citadel."
"see"; "Thanh Toan Village Market"; "rural market"; "morning"; "free"; "Thuy Thanh Commune"; "east"; "Charming rural market with local produce and food stalls. Great cultural immersion stop."
"see"; "Ho Quyen Arena"; "royal tiger arena"; "morning"; "free"; "Thuy Bieu Ward"; "south"; "An old amphitheater used for tiger-elephant fights. Crumbling but unique relic of royal entertainment."
"see"; "Elephant Springs"; "natural spring"; "all-day"; "30k VND (~1.2$)"; "Loc Tien Commune"; "north"; "Natural stream with pools and rocks shaped like elephants. Popular weekend getaway."
"see"; "Thuan An Beach"; "beach"; "all-day"; "free"; "Thuan An Town"; "east"; "The closest beach to Hue. Waves, wind, and grilled seafood."
"see"; "Hue Traditional Handicraft Village"; "craft village"; "afternoon"; "free"; "various locations"; "various"; "Visit bronze casting, conical hat, and wood carving villages around Hue. Great for workshops."
"see"; "La Residence Hotel Garden"; "colonial building"; "afternoon"; "free (outside)"; "5 Le Loi"; "center"; "Grand French colonial building turned hotel. You can walk the riverside garden or have tea there."
"see"; "Tu Dam Pagoda"; "pagoda"; "morning"; "free"; "1 Su Lieu Quan"; "center"; "One of Hue’s major Buddhist temples, known for its clean architecture and quiet environment. Active religious site."
"see"; "Hue Water Puppet Theater"; "theater"; "evening"; "100k VND (~4$)"; "16 Le Loi"; "center"; "Traditional Vietnamese water puppet performances with music and lights. Cultural, family-friendly experience."
"see"; "The Garden of Memory"; "memorial garden"; "afternoon"; "free"; "Phu Thuong Village"; "north"; "A tranquil sculpture garden dedicated to local artists and writers. Good for peaceful reflection."
"see"; "Tram Gian Thien Temple"; "temple"; "morning"; "free"; "Thuy Chau Commune"; "south"; "Ancient hilltop temple with 100 wooden columns and a sacred Bodhi tree. Little-known spiritual site."
"see"; "Dong Khanh Tomb"; "tomb"; "all-day"; "150k VND (~6$)"; "Thuy Xuan Ward"; "south"; "Smaller tomb of Emperor Dong Khanh. Quiet, elegant, and overshadowed by bigger tombs nearby."
"see"; "Hue Craft Museum"; "museum"; "afternoon"; "50k VND (~2$)"; "2 Nguyen Dinh Chieu"; "center"; "Small but curated collection of Hue’s craft heritage: woodwork, textiles, and metal casting."
"see"; "Thuy Thanh Rice Fields"; "countryside"; "morning"; "free"; "Thuy Thanh Village"; "east"; "Scenic rice paddies with buffalo paths and palm trees. Best seen by bicycle in early morning light."
"see"; "Kim Long Garden House Walk"; "heritage trail"; "morning"; "free"; "Kim Long Ward"; "north"; "Walking route through old aristocratic garden homes. Can be self-guided or with local tour."
"see"; "Canh Duong Mural Village"; "street art village"; "afternoon"; "free"; "Canh Duong Commune"; "east"; "Seaside village with colorful wall paintings and recycled decorations. Quiet but charming."
"see"; "Phan Boi Chau Memorial House"; "historic house"; "afternoon"; "free"; "4 Phan Boi Chau"; "center"; "Home of nationalist scholar Phan Boi Chau. Preserved in modest form with photos and writing."
"see"; "Tay Loc Market"; "market"; "morning"; "free"; "Tay Loc Ward"; "citadel"; "A true local market inside the citadel, full of produce, street food, and crafts. Very few tourists."
"see"; "Luong Dinh Cua Park"; "urban park"; "afternoon"; "free"; "Nguyen Sinh Cung Street"; "east"; "Riverbank park with grass and walkways. Great for sitting and watching the river drift by."
"see"; "Diem Phung Thi Art Space"; "art gallery"; "afternoon"; "30k VND (~1.2$)"; "114 Le Ngo Cat"; "center"; "Modern sculpture space featuring works by female artist Diem Phung Thi. Contemporary and quiet."
"see"; "Hoa Binh Gate"; "citadel gate"; "morning"; "free"; "South Citadel Wall"; "citadel"; "Main gate of the south citadel. Grand arch, walkable moat nearby, good photo opportunity."
"see"; "Nhon Hoa Forest Trail"; "nature trail"; "morning"; "free"; "Huong Thuy District"; "south"; "Natural pine forest with quiet walking paths. Some locals use it for jogging and meditation."
"see"; "Tuong Van Pagoda"; "pagoda"; "morning"; "free"; "Truong An Ward"; "south"; "A peaceful hilltop pagoda with a panoramic view of the southern suburbs. Rarely crowded."
"see"; "Cau Ngoi Thanh Toan"; "ancient bridge"; "morning"; "free"; "Thuy Thanh Village"; "east"; "Small roofed bridge over a canal near Thanh Toan market. Photogenic, historical, and active with locals."
"see"; "Traditional Paper Flower Village"; "craft village"; "afternoon"; "free"; "Thanh Tien Village"; "south"; "Village known for making paper flowers for Tet. Bright colors, great for photos and workshops."
"see"; "Tiger Arena and Elephant Temple"; "royal site"; "morning"; "free"; "Thuy Bieu Ward"; "south"; "Unusual site where tigers and elephants once fought for royal spectacle. Crumbling walls and ancient trees."
"see"; "Van Thanh Temple"; "temple"; "morning"; "free"; "Huong Vinh"; "north"; "Temple honoring Confucian scholars. Traditional layout and scholarly energy."
"see"; "Nguyen Dynasty Cannon Hall"; "military museum"; "morning"; "free"; "inside Imperial City"; "citadel"; "Display of large bronze cannons used to guard the citadel. Located near main flagpole."
"see"; "Thua Thien Hue History Museum"; "museum"; "afternoon"; "40k VND (~1.6$)"; "23 Doi Cung"; "center"; "Covers ancient Champa, Nguyen dynasty, and colonial Hue. Less known but very educational."
"see"; "Ruin of Bao Dai Villa"; "ruin"; "morning"; "free"; "Thuy Tien Hill"; "south"; "Abandoned hilltop villa once used by Emperor Bao Dai. Good for ghostly atmosphere and curious explorers."
"see"; "Ben Ngu Wharf"; "riverside site"; "afternoon"; "free"; "Ben Ngu Ward"; "center"; "Old boat pier used during the Nguyen era. Quiet park area with city river view and shade trees."
"see"; "Con Hen Viewpoint"; "river island"; "afternoon"; "free"; "Con Hen Island"; "river"; "Tiny island in the middle of the Perfume River. You can walk over for views and street food."
"see"; "Khe Ngang Lake"; "lake"; "afternoon"; "free"; "Huong Tra District"; "northwest"; "A peaceful man-made lake surrounded by hills. Locals go fishing or picnic here on weekends."
"see"; "Cau Da Garden"; "botanical garden"; "morning"; "free"; "Vinh Ve Village"; "south"; "Public garden with tropical plants, lotus ponds, and a mini bonsai area. Calm and under-visited."
"see"; "Da Vien Islet"; "river islet"; "morning"; "free"; "Perfume River (midstream)"; "river"; "Small islet on the river with a few temples and a riverside café. Can be reached by ferry."
"see"; "Dinh Market"; "market"; "morning"; "free"; "Dinh Market Street"; "citadel"; "A true local wet market with fish, herbs, and open-air food stalls. Authentic and lively."
"see"; "Song Huong Theater"; "performing arts"; "evening"; "80k VND (~3.2$)"; "7 Nguyen Tri Phuong"; "center"; "Government-run theater with occasional performances of traditional dance and drama."
"see"; "Hue Open Air Book Café"; "book café"; "afternoon"; "free (order required)"; "28 Le Hong Phong"; "center"; "Shaded reading space with open-air bookshelves and local tea. Hidden gem for readers."
"see"; "Ban Co Viewpoint"; "mountain lookout"; "all-day"; "free"; "near Hai Van Pass"; "north"; "High lookout point with chessboard-shaped rocks. Popular stop for motorbikes heading over the pass."
"see"; "Thien Lam Pagoda"; "pagoda"; "morning"; "free"; "Thuy Bang"; "southwest"; "Golden stupa rising from the hillside, with a long staircase and distant views. Serene and photogenic."
"see"; "Hue Lotus Pond Walk"; "flower trail"; "morning"; "free"; "Kim Long Lotus Area"; "north"; "Seasonal trail through blooming lotus ponds. Best in May–July. Early morning light is best for photos."
"see"; "French Colonial Villas"; "architecture"; "afternoon"; "free (outside only)"; "Tran Quoc Toan Street"; "center"; "Walk past old French villas from the 1900s, many with mossy walls and wooden shutters."
"see"; "XQ Embroidery Art Center"; "craft gallery"; "afternoon"; "free"; "5 Le Loi"; "center"; "Intricate handmade silk embroidery displayed like fine art. You can see artisans working on site."
"see"; "Duong Xuan Spring"; "natural spring"; "morning"; "free"; "Duong Xuan Ward"; "south"; "Small forest spring used by locals to bathe and collect water. Quiet escape on hot days."
"see"; "Hue Cultural Center"; "cultural center"; "afternoon"; "free"; "1A Hung Vuong"; "center"; "Hosts free exhibitions and cultural talks. Sometimes has art, dance, or music events."
"see"; "Van Xuan Citadel Corner"; "fortified wall"; "morning"; "free"; "northwest Citadel edge"; "citadel"; "Unrestored corner of the citadel wall with mossy stones and wild vines. Great for urban explorers."
"see"; "Hue Incense Trail"; "thematic trail"; "afternoon"; "free"; "from Thuy Xuan to Tu Hieu"; "south"; "A walking/biking route that links several incense-producing households and temples in one peaceful trail."
"see"; "Ho Quyen Street Frescoes"; "street art"; "afternoon"; "free"; "along Ho Quyen Street"; "south"; "Colorful murals depicting royal scenes and village life. Great photo backdrop along a quiet street."
"see"; "Royal Musical Instrument Gallery"; "museum"; "afternoon"; "40k VND (~1.6$)"; "inside Imperial City"; "citadel"; "A small museum dedicated to gongs, zithers, and court instruments. Audio stations included."
"see"; "Cau Vang Mini Bridge"; "decorative bridge"; "morning"; "free"; "Tourism Village Area"; "east"; "A mini replica of Da Nang’s Golden Bridge with hand statues. Touristy but fun for photos."
"see"; "Ben Do Fish Market"; "floating market"; "morning"; "free"; "Ben Do Village"; "southwest"; "Morning river market where vendors sell seafood directly from boats. Very local, no tourists."
"see"; "Lac Tinh Garden"; "old house"; "morning"; "50k VND (~2$)"; "65 Phan Dinh Phung"; "center"; "Well-preserved royal-era home with bonsai garden and family shrine. Peaceful and quiet."
"see"; "Perfume River Biking Trail"; "bike trail"; "all-day"; "free"; "from Hue to Thuy Bieu"; "center"; "Shaded riverside trail for biking or walking. Locals jog here in the evening."
"see"; "Truong Tien Art Gallery"; "art gallery"; "afternoon"; "free"; "next to Truong Tien Bridge"; "center"; "Independent space showing local contemporary artists. Sometimes hosts talks or live painting."
"see"; "Kim Long Alley Street Food"; "street food lane"; "evening"; "free (food not included)"; "Kim Long Alley"; "north"; "Not a tourist site but a great place to eat and observe locals in the evening. Tiny stools and big flavors."
"see"; "Green Corridor Ecotourism Area"; "eco site"; "all-day"; "30k VND (~1.2$)"; "Nam Dong District"; "south"; "Protected forest and stream with basic eco-activities. Bird watching, hiking, and swimming."
"see"; "Hue Creative Hub"; "creative space"; "afternoon"; "free"; "18 Nguyen Sinh Cung"; "center"; "Co-working meets art café. Hosts workshops, exhibitions, and film nights. For young travelers and locals."
"stay"; "Hoa Hong Hotel"; "hotel"; "all-day"; "500k VND (~20$)/night"; "Le Loi Street"; "center"; "Hoa Hồng Hotel offers clean rooms near the river, with breakfast included and friendly reception."
"stay"; "Sunny Homestay"; "homestay"; "all-day"; "300k VND (~12$)/night"; "Nguyen Cong Tru Street"; "center"; "A cozy homestay run by a local family. Offers bike rental and home-cooked breakfast."
"stay"; "Pilgrimage Village"; "resort"; "all-day"; "2.5M VND (~100$)/night"; "Thuy Bieu Village"; "south"; "Luxury resort with spa, pools, and lush gardens. Great for relaxing outside city center."
"stay"; "Moonlight Hotel"; "hotel"; "all-day"; "800k VND (~32$)/night"; "Hung Vuong Street"; "center"; "Mid-range hotel with rooftop bar and spacious rooms. Near many local restaurants."
"stay"; "Hue Happy Hostel"; "hostel"; "all-day"; "150k VND (~6$)/night"; "Chu Van An Street"; "center"; "Backpacker-friendly hostel with dorms and free breakfast. Walking distance to nightlife."
"stay"; "Tam Tinh Vien"; "homestay"; "all-day"; "400k VND (~16$)/night"; "Kim Long Street"; "north"; "Peaceful homestay near pagodas. Decorated in traditional Hue style with garden courtyard."
"stay"; "Eldora Hotel"; "hotel"; "all-day"; "1.2M VND (~48$)/night"; "Tran Quang Khai Street"; "center"; "Elegant French-style hotel with pool and classy interiors. Popular with couples."
"stay"; "Beach Bar Villa"; "villa"; "all-day"; "1.8M VND (~72$)/night"; "Thuan An Beach"; "east"; "Private beachfront villa with ocean view, BBQ space, and private pool. Ideal for groups."
"stay"; "Silk Path Grand Hue"; "resort"; "all-day"; "3.2M VND (~130$)/night"; "Le Loi Street"; "center"; "5-star resort with garden, piano lounge, spa, and excellent river view."
"stay"; "La Paix Hostel"; "hostel"; "all-day"; "180k VND (~7$)/night"; "Phan Ngu Lao Street"; "center"; "Trendy hostel with artistic murals and game area. Welcoming atmosphere for solo travelers."
"stay"; "Nha Que Homestay"; "homestay"; "all-day"; "250k VND (~10$)/night"; "Thuy Bieu"; "south"; "Countryside homestay with pomelo garden, open-air bathrooms, and local meals available."
"stay"; "Imperial Hue Hotel"; "hotel"; "all-day"; "1.5M VND (~60$)/night"; "Hung Vuong Street"; "center"; "Luxury hotel with rooftop pool, casino, and panoramic city views."
"stay"; "Mango Garden Villa"; "villa"; "all-day"; "1.1M VND (~44$)/night"; "Nguyen Sinh Cung Street"; "east"; "Villa with garden patio, outdoor kitchen, and quiet surroundings. Great for family stays."
"stay"; "Hue Riverside Boutique Resort"; "resort"; "all-day"; "2.2M VND (~88$)/night"; "Ngoc Anh Village"; "south"; "Eco-resort along the Perfume River with bike trails and organic meals."
"stay"; "Hue Memory Homestay"; "homestay"; "all-day"; "280k VND (~11$)/night"; "Ben Nghe Street"; "center"; "Minimalist rooms with shared kitchen and daily fruit baskets. Clean and quiet."
"stay"; "The Scarlett Hotel"; "hotel"; "all-day"; "950k VND (~38$)/night"; "Le Loi Street"; "center"; "Boutique hotel with modern amenities and chic rooms. Great location for walking tours."
"stay"; "Sunrise Beach Resort"; "resort"; "all-day"; "2.7M VND (~110$)/night"; "Canh Duong Beach"; "east"; "High-end resort right on the beach. Spa, infinity pool, and oceanfront breakfast."
"stay"; "Soleil Hostel"; "hostel"; "all-day"; "160k VND (~6.5$)/night"; "Chu Van An Street"; "center"; "Clean and colorful hostel with bunk beds, lockers, and common space for meeting travelers."
"stay"; "Zen House Homestay"; "homestay"; "all-day"; "350k VND (~14$)/night"; "Thuy Bieu Village"; "south"; "Zen-inspired décor, small meditation garden, and cooking classes available."
"stay"; "Villa Garden Hue"; "villa"; "all-day"; "1.6M VND (~65$)/night"; "Le Thanh Ton Street"; "center"; "Colonial-style villa with pool, home theater, and private garden. Ideal for families or small groups."
"stay"; "The Purple Hue BnB"; "homestay"; "all-day"; "320k VND (~13$)/night"; "Dang Thai Than Street"; "citadel"; "Locally owned guesthouse with personalized city guides and Vietnamese breakfasts."
"stay"; "Alba Spa Hotel"; "hotel"; "all-day"; "1M VND (~40$)/night"; "Nguyen Chi Thanh Street"; "center"; "Spa hotel with natural hot spring water and salt steam rooms. Comfortable and relaxing."
"stay"; "Pomelo Garden Villas"; "villa"; "all-day"; "1.9M VND (~76$)/night"; "Kim Long Area"; "north"; "Multiple villas set within a pomelo garden. Romantic and spacious with outdoor showers."
"stay"; "Hue Stay Hostel"; "hostel"; "all-day"; "140k VND (~5.5$)/night"; "Vo Thi Sau Street"; "center"; "Budget hostel with free welcome drink, luggage storage, and 24h front desk."
"stay"; "A-Maze Riverside Lodge"; "homestay"; "all-day"; "380k VND (~15$)/night"; "Hue Riverside Trail"; "south"; "Charming riverside wooden lodge with hammocks and BBQ deck. Great for peace and views."
"stay"; "Hue Chic Hotel"; "hotel"; "all-day"; "850k VND (~34$)/night"; "Bui Thi Xuan Street"; "center"; "Boutique hotel with modern design, garden breakfast area, and bike rentals."
"stay"; "Tinh Tam Homestay"; "homestay"; "all-day"; "270k VND (~11$)/night"; "Tinh Tam Lake"; "citadel"; "Simple rooms by the lake with lotus views and local family hosts."
"stay"; "Blue Sky Hostel"; "hostel"; "all-day"; "170k VND (~7$)/night"; "Chu Van An Street"; "center"; "Colorful dorms with rooftop chill zone and community dinners."
"stay"; "Lapochine Beach Resort"; "resort"; "all-day"; "3.5M VND (~140$)/night"; "Thuan An Beach"; "east"; "Luxury beachfront resort with spacious villas, spa, and multiple pools."
"stay"; "AURA Homestay"; "homestay"; "all-day"; "290k VND (~12$)/night"; "Thuy Xuan Ward"; "south"; "Quiet neighborhood, cozy rooms with handmade décor and strong Wi-Fi."
"stay"; "Victory Villa"; "villa"; "all-day"; "2.1M VND (~84$)/night"; "Kim Long Street"; "north"; "Private pool villa with indoor kitchen, suitable for families or groups up to 8."
"stay"; "Rosaleen Boutique Hotel"; "hotel"; "all-day"; "980k VND (~39$)/night"; "Nguyen Tri Phuong Street"; "center"; "Modern rooms with rooftop bar and central location near nightlife."
"stay"; "Kha Hostel"; "hostel"; "all-day"; "150k VND (~6$)/night"; "Phan Chu Trinh Street"; "center"; "Minimalist design, comfortable beds, ideal for digital nomads or solo travelers."
"stay"; "Aloe Garden Homestay"; "homestay"; "all-day"; "310k VND (~13$)/night"; "Thuy Bieu Village"; "south"; "Green courtyard, hammocks, and home-cooked dinners by local hosts."
"stay"; "Riversoul Villa"; "villa"; "all-day"; "1.7M VND (~68$)/night"; "Nguyen Cong Tru Street"; "center"; "Modern river-view villa with balcony and living room. Great for couples."
"stay"; "Villa Citadel"; "villa"; "all-day"; "2M VND (~80$)/night"; "near Imperial City"; "citadel"; "Elegant villa with ancient wall view, luxury bedding, and quiet alley location."
"stay"; "Coco Riverside Hostel"; "hostel"; "all-day"; "160k VND (~6.5$)/night"; "Doi Cung Street"; "center"; "Hostel with bar, bikes, and riverside seating. Young and friendly vibes."
"stay"; "Maison Vy Hue"; "hotel"; "all-day"; "1.3M VND (~52$)/night"; "Tran Hung Dao Street"; "center"; "French-Indochine style, outdoor café, and helpful staff with tour bookings."
"stay"; "Banana Leaf Bungalow"; "homestay"; "all-day"; "370k VND (~15$)/night"; "Thuy Thanh Village"; "east"; "Bamboo bungalows near rice fields. Eco-friendly and quiet for digital detox."
"stay"; "Peaceful Hue Garden House"; "homestay"; "all-day"; "330k VND (~13$)/night"; "Kim Long"; "north"; "Old garden house converted to guest stay. Antique furniture and breakfast on terrace."
"stay"; "Ciel Homestay & Art"; "homestay"; "all-day"; "280k VND (~11$)/night"; "Vo Thi Sau Street"; "center"; "Art-themed rooms, gallery space downstairs, and free Vietnamese tea."
"stay"; "Melody Hotel Hue"; "hotel"; "all-day"; "890k VND (~36$)/night"; "Hung Vuong Street"; "center"; "Newly opened hotel with breakfast buffet and city-view rooms."
"stay"; "Hue Friendly Villa"; "villa"; "all-day"; "1.4M VND (~56$)/night"; "Le Lai Street"; "center"; "Villa with terrace, kitchen, and outdoor seating. Great for long stays."
"stay"; "Blue Lotus BnB"; "homestay"; "all-day"; "300k VND (~12$)/night"; "Phan Dang Luu Street"; "center"; "Clean and friendly, daily cleaning, near street food alley and small cafés."
"stay"; "Nam Pho House"; "homestay"; "all-day"; "350k VND (~14$)/night"; "Nam Pho Village"; "south"; "Wooden house with shared kitchen, bicycles, and fruit trees in backyard."
"stay"; "Infinity Pool Retreat"; "resort"; "all-day"; "2.8M VND (~112$)/night"; "Lap An Lagoon"; "north"; "Resort with mountain views, large pool, and seafood restaurant on site."
"stay"; "Sunny Side Hostel"; "hostel"; "all-day"; "145k VND (~5.8$)/night"; "Chu Van An Street"; "center"; "Compact beds, cozy common room, and night market just 2 mins away."
"stay"; "Rose Garden Inn"; "hotel"; "all-day"; "950k VND (~38$)/night"; "Nguyen Sinh Cung Street"; "east"; "Hotel with garden lounge, tea set in every room, and elevator access."
"stay"; "Pomelo Spirit Homestay"; "homestay"; "all-day"; "320k VND (~13$)/night"; "Thuy Bieu"; "south"; "Open-air bathroom, natural materials, and traditional architecture."
"stay"; "Lagoon Nest Villa"; "villa"; "all-day"; "1.9M VND (~76$)/night"; "Tam Giang Lagoon"; "north"; "Modern villa facing the lagoon, with BBQ terrace and kayaks available."
"stay"; "Hue Soul Homestay"; "homestay"; "all-day"; "290k VND (~12$)/night"; "Ben Nghe Street"; "center"; "Art-filled home with hand-painted walls, personal stories, and a sweet host family."
"stay"; "Sky Garden Hue"; "hotel"; "all-day"; "980k VND (~39$)/night"; "Le Loi Street"; "center"; "Sky bar with garden rooftop, modern rooms, and daily fresh juice included."
"stay"; "Hue Serenity Villa"; "villa"; "all-day"; "2.2M VND (~88$)/night"; "Kim Long Street"; "north"; "Elegant villa with private garden, meditation room, and optional yoga classes."
"stay"; "Clover Hostel"; "hostel"; "all-day"; "155k VND (~6.2$)/night"; "Pham Ngu Lao Street"; "center"; "Quiet dorm rooms with curtain beds, personal fans, and late check-in available."
"stay"; "Villa de Lotus"; "villa"; "all-day"; "1.7M VND (~68$)/night"; "Thuy Bieu"; "south"; "Lotus pond view, romantic patio, and Vietnamese antique touches inside each room."
"stay"; "Thanh Lich Royal Boutique"; "hotel"; "all-day"; "1.3M VND (~52$)/night"; "Ben Nghe Street"; "center"; "Royal-themed rooms, gym, indoor pool, and close to Perfume River."
"stay"; "The Dreamers Homestay"; "homestay"; "all-day"; "310k VND (~12.5$)/night"; "Dang Thai Than Street"; "citadel"; "Boho-style homestay with hammock lounge and friendly student hosts."
"stay"; "Nam Giao Retreat"; "villa"; "all-day"; "2.4M VND (~96$)/night"; "Nam Giao Area"; "south"; "Private compound near the forest with breakfast under pine trees and spa service."
"stay"; "Memory Lane Hostel"; "hostel"; "all-day"; "165k VND (~6.6$)/night"; "Vo Thi Sau Street"; "center"; "Nostalgic décor with old records and maps. Great for solo travelers and groups."
"stay"; "The White House Hue"; "homestay"; "all-day"; "350k VND (~14$)/night"; "Nguyen Tri Phuong Street"; "center"; "Whitewashed home with flower balconies and host family cooking Hue specialties."
"stay"; "Hue River Boutique Villa"; "villa"; "all-day"; "1.5M VND (~60$)/night"; "Le Loi Street"; "center"; "Riverside view, private library room, and custom-decorated interiors for long stays."
