"type"; "name"; "description"; "time"; "price"; "location"; "area"; "note"
"stay"; "Charming Hue Hostel"; "hostel"; "all-day"; "150k VND (~6$)/night"; "Chu Van An Street"; "center"; "Social hostel with daily group dinners and late-night pub access included."
"stay"; "Rice Field Hideaway"; "villa"; "all-day"; "1.8M VND (~72$)/night"; "Thanh Toan Village"; "east"; "Views of open rice paddies, outdoor bathtub, and bamboo floors. Pure rural vibe."
"stay"; "Aroma Homestay & Tea"; "homestay"; "all-day"; "320k VND (~13$)/night"; "Phan Dang Luu"; "center"; "Herbal tea corner, essential oil diffusers, and cozy rooms with soft bedding."
"stay"; "The Alcove Hue"; "hotel"; "all-day"; "1.1M VND (~44$)/night"; "Hung Vuong Street"; "center"; "Hotel with rooftop pool, light breakfast buffet, and elegant lobby with piano."
"stay"; "Green Bamboo Lodge"; "homestay"; "all-day"; "280k VND (~11$)/night"; "Duong Xuan Ward"; "south"; "Rustic stay with bamboo walls, mosquito net beds, and frog songs at night."
"stay"; "Citadel View Villa"; "villa"; "all-day"; "1.9M VND (~76$)/night"; "Dang Thai Than Street"; "citadel"; "Direct view of the old citadel wall, large open windows, and rooftop café."
"stay"; "The Note Hue Hostel"; "hostel"; "all-day"; "160k VND (~6.5$)/night"; "Vo Thi Sau Street"; "center"; "Every room decorated with sticky notes from past guests. Inspiring, youthful energy."
"stay"; "Hue Eco Home"; "homestay"; "all-day"; "300k VND (~12$)/night"; "Thuy Xuan"; "south"; "Built from reclaimed wood, eco soaps, and filtered drinking water system included."
"stay"; "Golden Palm Hotel"; "hotel"; "all-day"; "950k VND (~38$)/night"; "Nguyen Sinh Cung"; "east"; "Modern business-style hotel with strong AC, work desk, and free parking."
"stay"; "An House Hue"; "homestay"; "all-day"; "295k VND (~11.8$)/night"; "Kim Long"; "north"; "Soft tones, spacious rooms, and shared balcony with banana trees all around."
"stay"; "Happy Garden Inn"; "hotel"; "all-day"; "880k VND (~35$)/night"; "Le Loi"; "center"; "Garden space for breakfast, spa area, and attentive staff."
"stay"; "The Mango Tree Homestay"; "homestay"; "all-day"; "315k VND (~12.6$)/night"; "Thuy Bieu"; "south"; "Stay under the shade of mango trees, hammock naps, and daily vegetarian meals."
"stay"; "City Light Hostel"; "hostel"; "all-day"; "170k VND (~7$)/night"; "Chu Van An"; "center"; "Bunk beds with blackout curtains, rooftop games, and bar happy hour."
"stay"; "Villa Perfume Dream"; "villa"; "all-day"; "2.1M VND (~84$)/night"; "near Perfume River"; "center"; "Large French-style villa with music corner and terrace over the river."
"stay"; "River Zen Homestay"; "homestay"; "all-day"; "340k VND (~13.6$)/night"; "Thuy Bieu Village"; "south"; "Peaceful riverside home with yoga space, meditation room, and herbal drinks."
"stay"; "Hue Vintage House"; "homestay"; "all-day"; "300k VND (~12$)/night"; "Ben Nghe Street"; "center"; "Retro decor, vintage vinyl player in lounge, and soft jazz all day."
"stay"; "Hana Hotel Hue"; "hotel"; "all-day"; "890k VND (~36$)/night"; "Nguyen Thai Hoc Street"; "center"; "Clean, professional service, breakfast buffet, and walking distance to river."
"stay"; "Cloud Forest Retreat"; "resort"; "all-day"; "3.3M VND (~132$)/night"; "Bach Ma National Park"; "west"; "Hidden retreat in the mountain forest with nature trails and wooden cabins."
"stay"; "Little House Hostel"; "hostel"; "all-day"; "145k VND (~5.8$)/night"; "Phan Dinh Phung"; "center"; "Small, cozy hostel with free tea, shared kitchen, and local market nearby."
"stay"; "Floral Garden Villa"; "villa"; "all-day"; "2M VND (~80$)/night"; "Kim Long Area"; "north"; "Spacious villa with flower garden, bamboo beds, and open-sky bathroom."
"stay"; "Hue Delight Hotel"; "hotel"; "all-day"; "970k VND (~39$)/night"; "Hung Vuong Street"; "center"; "Business-style hotel with breakfast lounge and strong Wi-Fi. Very central."
"stay"; "Secret Nest Homestay"; "homestay"; "all-day"; "290k VND (~12$)/night"; "Thuy Xuan Ward"; "south"; "Charming little homestay hidden in the back alley with a book exchange."
"stay"; "Hue Backpackers Hostel"; "hostel"; "all-day"; "150k VND (~6$)/night"; "Chu Van An Street"; "center"; "Party-friendly hostel with live music, free shots, and nightly pub crawls."
"stay"; "Orchid Garden Resort"; "resort"; "all-day"; "2.5M VND (~100$)/night"; "Thuy Bieu"; "south"; "Garden resort with small villas, orchid greenhouse, and breakfast buffet."
"stay"; "La Siesta Hue"; "hotel"; "all-day"; "1.4M VND (~56$)/night"; "Ben Nghe Street"; "center"; "Modern minimalist hotel with excellent river view and rooftop bar."
"stay"; "Hue House of Peace"; "homestay"; "all-day"; "310k VND (~12.5$)/night"; "Kim Long"; "north"; "Tranquil house with koi pond and family-run vegetarian meals. Great for writers."
"stay"; "Tropical Vibes Villa"; "villa"; "all-day"; "2.3M VND (~92$)/night"; "Tam Giang Lagoon"; "north"; "Colorful tropical design, direct lagoon access, BBQ space, and night kayaking."
"stay"; "The Green Door Homestay"; "homestay"; "all-day"; "295k VND (~11.8$)/night"; "Dang Huy Tru Street"; "center"; "Personalized maps, tour recommendations, and green-painted doors throughout."
"stay"; "Royal Hue Lodge"; "hotel"; "all-day"; "1.2M VND (~48$)/night"; "near Citadel Gate"; "citadel"; "Wood-heavy decor, royal portraits in every room, and quiet neighborhood."
"stay"; "Starry Night Hostel"; "hostel"; "all-day"; "160k VND (~6.5$)/night"; "Le Loi"; "center"; "Constellation-themed rooms with glow-in-the-dark walls and stargazing rooftop."
"stay"; "Sunleaf Eco Homestay"; "homestay"; "all-day"; "310k VND (~12.4$)/night"; "Thuy Thanh Village"; "east"; "Solar-powered, bamboo-built, plastic-free home. Ideal for eco-conscious guests."
"stay"; "Rose Hue Villa"; "villa"; "all-day"; "2M VND (~80$)/night"; "Phan Dang Luu"; "center"; "Private villa with rose-covered walls, romantic lighting, and full kitchen."
"stay"; "Lantern River Homestay"; "homestay"; "all-day"; "300k VND (~12$)/night"; "Doi Cung Street"; "center"; "Every room decorated with handmade paper lanterns. Very local feel."
"stay"; "Hue Lotus Retreat"; "resort"; "all-day"; "2.6M VND (~104$)/night"; "near Perfume River"; "south"; "Luxury retreat with lotus pond, organic food, yoga platform, and moonlight spa."
"stay"; "Happy Buddha Homestay"; "homestay"; "all-day"; "280k VND (~11$)/night"; "Kim Long"; "north"; "Decorated with laughing Buddha statues and peaceful pond. Hosts offer free tea meditation."
"stay"; "Terracotta Villa"; "villa"; "all-day"; "2.2M VND (~88$)/night"; "Thuy Bieu"; "south"; "Earthy clay-colored walls, large kitchen space, hammock garden and mountain view."
"stay"; "Ngoc Lan Guesthouse"; "homestay"; "all-day"; "270k VND (~10.8$)/night"; "Phan Boi Chau"; "center"; "Basic but comfortable guesthouse with free laundry and homecooked meals."
"stay"; "Hue Downtown Hostel"; "hostel"; "all-day"; "150k VND (~6$)/night"; "Vo Thi Sau"; "center"; "Perfect location near bars and food. Free map, welcome drink, and tour desk."
"stay"; "Harmony Hue Hotel"; "hotel"; "all-day"; "1M VND (~40$)/night"; "Le Loi"; "center"; "Balanced décor, spacious rooms, and walking distance to river park."
